X1,LOCAL_VOTACAO,FORNECIDOS,OBTIDOS
8,ESCOLA RURAL MUNICIPAL VICENTE MACHADO,"AGUDOS DO SUL - PR 419, KM 21. CEP: 83850000","Agudos do Sul - PR-419, NA. CEP: 83850000"
11,ESCOLA RURAL MUNICIPAL VITAL BRASIL,AGUDOS DO SUL - ESTRADA PRINCIPAL. CEP: 83850000,"Agudos do Sul - Estrada Principal Taboao, NA. CEP: 83850000"
32,ESCOLA ESTADUAL JARDIM APUCARANA,"ALMIRANTE TAMANDARÉ - RUA INDAIAL, 60. CEP: 83505100","Almirante Tamandaré - Rua Indaial, 60. CEP: 83504670"
71,ESCOLA MUNICIPAL SÃO GABRIEL,"FAZENDA RIO GRANDE - RUA DINAMARCA, 737. CEP: 83823208","Fazenda Rio Grande - Rua Dinamarca, 737. CEP: 83823208"
84,CENTRO MUNICIPAL DE EDUCAÇÃO INFANTIL -  CACHOEIRA,"ARAUCÁRIA - RUA ANTONIO PINHO RIBAS, 24. CEP: 83701204","Araucária - Rua Antônio Pinho Ribas, NA. CEP: 83701200"
122,ESCOLA MUNICIPAL PROFESSOR AMBROSIO IANTAS,"ARAUCÁRIA - RUA PAU-BRASIL, 50. CEP: 83705420","Araucária - Rua Pau-Brasil, 50. CEP: 83705420"
123,ESCOLA MUNICIPAL PROFESSORA ELVIRA DE FRANÇA BUSCHMANN,"ARAUCÁRIA - RUA UIRAPURU, 228. CEP: 83706070","Araucária - Rua Uirapuru, 228. CEP: 81330200"
140,BANDA MUNICIPAL DE ARAUCÁRIA,"ARAUCÁRIA - RUA CORONEL JOÃO ANTONIO XAVIER, 906. CEP: 83702420","Araucária - Rua Coronel João Antonio Xavier, 906. CEP: 83702420"
151,ESCOLA RURAL MUNICIPAL ITAMBE,"BALSA NOVA - RUA DAVID FAY, S/N. CEP: 83650000","Balsa Nova - Estrada Para Balsa Nova, NA. CEP: 83650000"
158,ESCOLA MUNICIPAL DE CANDIDOS,"ITAPERUÇU - RUA JOÃO DIVETE BETIM, S/N. CEP: 83560000","Itaperuçu - Rua João Divete Betim, NA. CEP: 83560000"
204,ESCOLA ESTADUAL RURAL NOSSA SENHORA DA LUZ (DESATIVADA),"CAMPO LARGO - RUA PRINCIPAL, SN. CEP: 83600000","Campo Largo - Estrada Figueiredo, NA. CEP: 83601630"
233,ESCOLA MUNICIPAL HANS ERNEST SCHMIDT,CAMPO LARGO - RUA PARAIBA - SN. CEP: 83604300,"Campo Largo - Rua Paraíba, NA. CEP: 83604300"
247,COLÉGIO ESTADUAL SEVERO FERREIRA RUPPEL,"TUNAS DO PARANÁ - RUA JUVENAL GONÇALVES DOS REIS, 145. CEP: 83480000","Tunas do Paraná - Rua Juvenal G dos Reis 145, 145. CEP: 83480000"
266,ESCOLA RURAL MUNICIPAL MILTON TEILO,"CERRO AZUL - RUA PRINCIPAL, S/N. CEP: 83570000","Cerro Azul - Estrada Marginal do Rio Ponta Grossa, NA. CEP: 83570000"
267,ESCOLA RURAL MUNICIPAL  BARRA BONITA I,"CERRO AZUL - RUA PRINCIPAL, S/N. CEP: 83570000","Cerro Azul - Travessa Souza, NA. CEP: 83570000"
272,ESCOLA RURAL MUNICIPAL ANGELO MOTTIM,"CERRO AZUL - RUA PRINCIPAL, S/N. CEP: 83570000","Cerro Azul - Travessa Souza, NA. CEP: 83570000"
273,ESCOLA RURAL MUNICIPAL RIBEIRÃO BONITO DO TURVO,"CERRO AZUL - RUA PRINCIPAL, S/N. CEP: 83570000","Cerro Azul - Travessa Souza, NA. CEP: 83570000"
292,ESCOLA MUNICIPAL JOSE BRUNETTI GUGELMIN,"PINHAIS - RUA MALASIA, 385. CEP: 83320270","Pinhais - Rua Malásia, 385. CEP: 83320270"
316,COLÉGIO ESTADUAL PROFESSOR DANIEL ROCHA,"PINHAIS - RUA NATAL FABRI, 01. CEP: 83326055","Pinhais - Rua Natal Fabri, 01. CEP: 83326055"
321,EMPRESA BRASILEIRA DE PESQUISA AGROPECUARIA EMBRAPA FLORESTAS-EMBRAPA,COLOMBO - BR 476 - ESTRADA DA RIBEIRA KM 111. CEP: 83411000,"Colombo - Estrada da Ribeira, 476. CEP: 83411"
331,ESCOLA RURAL MUNICIPAL IMBUIAL DA ROSEIRA,"COLOMBO - ESTRADA DA RIBEIRA, 564 KM 23. CEP: 83411000","Colombo - Estrada da Ribeira, 564. CEP: 83411"
332,COLÉGIO ESTADUAL RUI BARBOSA,"COLOMBO - RUA PIETRO CANESTRARO FILHO, 116. CEP: 83412100","Colombo - Rua Ricardo Canestraro, 116. CEP: 83412150"
336,SALAO DA PAROQUIA DE COLONIA FARIA,"COLOMBO - RUA PRESIDENTE FARIA, 3423. CEP: 83411050","Colombo - Rua Presidente Faria, 3423. CEP: 83411050"
345,ESCOLA MUNICIPAL BARAO DO MAUA,"COLOMBO - RUA ANAIR BONATO TOSIN, 580. CEP: 83413580","Colombo - Rua Anair Bonato Tosin, NA. CEP: 83413580"
359,COLÉGIO ESTADUAL DOM JOAO BOSCO,"COLOMBO - RUA JUSTINIANO ALVES DE SOUZA, 170. CEP: 83402360","Colombo - Rua Justimiano Alves de Souza, 170. CEP: 83402360"
363,COLÉGIO ESTADUAL PRESIDENTE ABRAHAN LINCOLN,"COLOMBO - RUA ZACARIAS DE PAULA XAVIER, 561- CENTRO. CEP: 83414160","Colombo - Rua Zacarias de Paula Xavier, 561. CEP: 83414160"
448,ESCOLA MUNICIPAL MARINGA,CURITIBA - RUA BRASILIO PERY MOREIRA    17. CEP: 81880060,"Curitiba - Rua Brasílio Pery Moreira, 17. CEP: 81880"
523,ESCOLA MUNICIPAL ROLANDIA,CURITIBA - RUA DESEMBARGADOR ANTONIO DE PAULA 3451. CEP: 81750450,"Curitiba - Rua Desembargador Antônio de Paula, 3451. CEP: 81750450"
530,ESCOLA ESTADUAL MILTON CARNEIRO,"CURITIBA - RUA CAPITAO LOPES QUINTAS, S/N. CEP: 81860090","Curitiba - Rua Capitão Roberto Lopes Quintas, NA. CEP: 81860090"
531,CEI PROFESSORA MARIA AUGUSTA JOUVE,"CURITIBA - RUA PASTOR ANTONIO POLITO, 1145. CEP: 81770260","Curitiba - Rua Pastor Antônio Polito, 1145. CEP: 81770260"
537,COLÉGIO ADVENTISTA DO ALTO BOQUEIRÃO,"CURITIBA - RUA BOM PASTOR, 606. CEP: 81720310","Curitiba - Rua Bom Pastor, 606. CEP: 81720310"
552,FACULDADE MACHADO DE ASSIS-FAMA,CURITIBA - RUA PROF WALDIR DE JESUS 99-VILA FELIZ. CEP: 81130110,"Curitiba - Rua Professor Waldir de Jesus, 99. CEP: 81130110"
553,COLÉGIO ESTADUAL EMILIO DE MENEZES,CURITIBA - RUA JOSE ZALESKI 450 - VILA FELIZ. CEP: 81130060,"Curitiba - Rua José Zaleski, 450. CEP: 81130060"
559,ESCOLA MUNICIPAL CEI PROFESSOR ANTONIO PIETRUZA,"CURITIBA - RUA JOAO AMADEU PEDRO BOM, 135 -VILA PALMEIRA. CEP: 81940080","Curitiba - Rua João Amadeu Pedro Bom, 137. CEP: 81940080"
582,COLÉGIO ESTADUAL PROFESSORA MARLI QUEIROZ AZEVEDO,"CURITIBA - RUA CYRO CORREIA PEREIRA, N. 3506 - VITÓRIA RÉGIA. CEP: 81460050","Curitiba - Rua Cyro Correia Pereira, 3506. CEP: 81460050"
610,CEI BELMIRO CESAR,"CURITIBA - RUA PADRE MANOEL DA NOBREGA, 327. CEP: 80000000","Curitiba - Rua Padre Manuel da Nóbrega, 327. CEP: 81030330"
616,CEMEI SANTA AMÉLIA,"CURITIBA - RUA FERNANDO DE SOUZA COSTA, 102. CEP: 81330170","Curitiba - Rua Fernando de Souza Costa, 102. CEP: 81330170"
623,ESCOLA ESTADUAL RIO BRANCO,CURITIBA - AV BISPO DOM JOSE  2426. CEP: 80440080,"Curitiba - Rua Bispo Dom José, 2426. CEP: 80440080"
657,ESCOLA ESTADUAL DOM PEDRO II,CURITIBA - AVENIDA BISPO DOM JOSE  2567. CEP: 80440080,"Curitiba - Rua Bispo Dom José, 2567. CEP: 80440080"
664,COLEGIO NOVO ATENEU,"CURITIBA - AV. NOSSA SENHORA APARECIDA, 1468. CEP: 80310110","Curitiba - Avenida Nossa Senhora Aparecida, 1468. CEP: 80310"
665,CLUBE CURITIBANO (SEDE ADMINISTRATIVA),"CURITIBA - AV. GETULIO VARGAS, 2857. CEP: 80240040","Curitiba - Avenida Presidente Getúlio Vargas, 2857. CEP: 80240040"
735,COLÉGIO ESTADUAL PAULO LEMINSKI,"CURITIBA - AV CORONEL AUGUSTO DE ALMEIDA GARRET, N. 135, PRÓXIMO AO DETRAN. CEP: 82820520","Curitiba - Avenida Coronel Augusto de Almeida Garret, 135. CEP: 82821002"
738,COLEGIO ESTADUAL MÁXIMO ATÍLIO ASINELLI,"CURITIBA - RUA JÚLIO WISCHRAL, N. 650, UBERABA DE CIMA. CEP: 81540590","Curitiba - Rua Júlio Wischral, 650. CEP: 81540590"
778,ESCOLA MUNICIPAL PROFESSORA MARIA MARLI PIOVEZAN,"CURITIBA - RUA VELCY BOLÍVAR GRANDÓ, S/N. CEP: 81560615","Curitiba - Rua Velcy Bolívar Grandó, NA. CEP: 81560615"
787,ESCOLA MUNICIPAL PAPA JOAO XXIII,"CURITIBA - RUA ITACOLOMI,  700 - VILA LEAO. CEP: 81070150","Curitiba - Rua Itacolomi, 700. CEP: 81070150"
792,ESCOLA MUNICIPAL PROFESSORA MARIA DO CARMO MARTINS,"CURITIBA - RUA JOAO DEMBINSKI, 700. CEP: 81270330","Curitiba - Rua João Dembinski, 700. CEP: 81270330"
818,ESCOLA MUNICIPAL SYBILLA WILLE DE LACERDA,"LAPA - AVENIDA ALOISEO LEONI, S/N. CEP: 83750000","Lapa - Avenida Aloísio Leoni, NA. CEP: 83750000"
849,ESCOLA MUNICIPAL PROFESSOR DAVID DA SILVA CARNEIRO (DAVID CARNEIRO),"LAPA - R PROF AUGUSTO MARIANO JUNIOR, S/N. CEP: 83750000","Lapa - Rua Professor Augusto Mariano Júnior, NA. CEP: 83750000"
867,ESCOLA RURAL MUNICIPAL JOAO CHEDE(DESATIVADA),MANDIRITUBA - CHIMBOVEIRO. CEP: 83800000,"Mandirituba - Rua João Mendes, 1-191. CEP: 83800000"
878,HOSPITAL SAO ROQUE,PIRAQUARA - AV BRASILIA-COLONIA SAO ROQUE. CEP: 83301390,"Piraquara - Avenida Brasília, NA. CEP: 83301390"
886,ESCOLA RURAL MUNICIPAL DONA JULIA WANDERLEY,"PIRAQUARA - RUA VAGNER LUIZ BOSCARIN, 55. CEP: 83307286","Piraquara - Rua Vagner Luis Boscardin, 55. CEP: NA"
894,ESCOLA MUNICIPAL OLGA RIBAS MARTINS,"PIRAQUARA - RUA GLORIA, 156. CEP: 83302090","Piraquara - Rua Glória, 156. CEP: 83302090"
915,ESCOLA RURAL MUNICIPAL FRANCISCO ALVES DE BASTOS,"QUITANDINHA - ESTRADA PRINCIPAL, S/N - ZONA RURAL. CEP: 83860000","Quitandinha - Estrada Rural, NA. CEP: 83840000"
953,ESCOLA RURAL MUNICIPAL DA RIBEIRINHA,"RIO BRANCO DO SUL - ESTRADA DA RIBEIRA, S/N. CEP: 83540000","Rio Branco do Sul - Rua Padre Ribeiro, NA. CEP: 83540000"
954,ESCOLA RURAL MUNICIPAL DARCY LEONEL DE FARIA,"RIO BRANCO DO SUL - ESTRADA DA RIBEIRA, S/N. CEP: 83540000","Rio Branco do Sul - Rua Doutor Zoni 18, 18. CEP: 83540000"
981,COLÉGIO ESTADUAL ANITA CANET,"SÃO JOSÉ DOS PINHAIS - RUA CAPITÃO BENJAMIM CLAUDINO BARBOSA, 13440. CEP: 83090250","São José dos Pinhais - Rua Benjamin Claudino Barbosa, 13498. CEP: 83090250"
994,ESCOLA MUNICIPAL FRANCISCO XAVIER DA SILVA,"SÃO JOSÉ DOS PINHAIS - RUA BENJAMIM NEGOSEKI, 20.001. CEP: 83025000","São José dos Pinhais - Rua Benjamin Negoseki 20, 20. CEP: 83021250"
1008,ESCOLA MUNICIPAL JOSE DE ANCHIETA,"SÃO JOSÉ DOS PINHAIS - R IAPO, 360. CEP: 83025480","São José dos Pinhais - Rua Iapó 360, 360. CEP: 83025480"
1017,CENTRO ESTADUAL DE EDUCAÇAO BÁSICA PARA JOVENS E ADULTOS,"SÃO JOSÉ DOS PINHAIS - R MENDES LEITÃO, 2724 - CENTRO. CEP: 83005150","São José dos Pinhais - Rua Mendes Leitão, 2724. CEP: 83005150"
1036,ESCOLA RURAL MUNICIPAL EMILIANO PERNETA,TIJUCAS DO SUL - PR 281 KM 04. CEP: 83190000,"Tijucas do Sul - PR-281 04, 04. CEP: 83190000"
