"","X1","idLV","SG_UF","CD_LOCALIDADE_TSE","NM_LOCALIDADE","NR_ZONA","NR_LOCVOT","NM_LOCVOT","DS_ENDERECO","DS_BAIRRO","NR_CEP","n_locs","street_name","street_number","locality","postal_code","sub_locality","provider","latitude","longitude","dispersion","clusters_count","providers_count","levenshtein_match_street_name"
"132",3145,91219581422,"MT",91219,"NOSSA SENHORA DO LIVRAMENTO",58,1422,"ESCOLA ESTADUAL  TEREZA CONCEIÇÃO ARRUDA","RODOV BR 060 -COMUNIDADE MATA CAVALO","ZONA RURAL",78150000,2,"NA","NA","NA",NA,"NA","NA",NA,NA,NA,NA,NA,NA
"133",3146,91219581430,"MT",91219,"NOSSA SENHORA DO LIVRAMENTO",58,1430,"ESCOLA MUNICIPAL BENEDITO PEREIRA LEITE","COMUNIDADE RIO DOS PEIXES","ZONA RURAL",78150000,1,"NA","NA","NA",NA,"NA","NA",NA,NA,NA,NA,NA,NA
"134",3147,91219581449,"MT",91219,"NOSSA SENHORA DO LIVRAMENTO",58,1449,"EMEB MONTE HERMON","COMUNIDADE NINHO DAS AGUIAS","ZONA RURAL",78000000,1,"NA","NA","NA",NA,"NA","NA",NA,NA,NA,NA,NA,NA
"135",3152,91553381090,"MT",91553,"SANTO ANTÔNIO DO LEVERGER",38,1090,"ESCOLA ESTADUAL FAUSTINO DIAS DE AMORIM","RUA BOM JESUS, S/NR","VARGINHA (ZONA RURAL)",78180000,3,"NA","NA","NA",NA,"NA","NA",NA,NA,NA,NA,NA,NA
"136",3154,91553381112,"MT",91553,"SANTO ANTÔNIO DO LEVERGER",38,1112,"ESCOLA MUNICIPAL DO BARREIRINHO","AV. PRINCIPAL, S/NR","BARREIRINHO (ZONA RURAL)",78180000,1,"NA","NA","NA",NA,"NA","NA",NA,NA,NA,NA,NA,NA
"137",3155,91553381120,"MT",91553,"SANTO ANTÔNIO DO LEVERGER",38,1120,"ESCOLA MUNICIPAL JERÔNIMO NUNES RONDON","AV. PRINCIPAL, S/NR","BARRA DO ARICÁ (ZONA RURAL)",78180000,1,"NA","NA","NA",NA,"NA","NA",NA,NA,NA,NA,NA,NA
"138",3156,91553381139,"MT",91553,"SANTO ANTÔNIO DO LEVERGER",38,1139,"ESCOLA MUNICIPAL DO BARRANCO ALTO","AV. PRINCIPAL, S/NR","BARRANCO ALTO (ZONA RURAL)",78180000,1,"NA","NA","NA",NA,"NA","NA",NA,NA,NA,NA,NA,NA
"139",3157,91553381155,"MT",91553,"SANTO ANTÔNIO DO LEVERGER",38,1155,"ESCOLA MUNICIPAL DA FAZENDA MIMOSO","AV. PRINCIPAL, S/NR","FAZENDA MIMOSO (ZONA RURAL)",78180000,1,"NA","NA","NA",NA,"NA","NA",NA,NA,NA,NA,NA,NA
"140",3158,91553381171,"MT",91553,"SANTO ANTÔNIO DO LEVERGER",38,1171,"ESCOLA ESTADUAL SANTA CLAUDINA","AV. PRINCIPAL, S/NR","MIMOSO (ZONA RURAL)",78188000,2,"NA","NA","NA",NA,"NA","NA",NA,NA,NA,NA,NA,NA
"141",3159,91553381180,"MT",91553,"SANTO ANTÔNIO DO LEVERGER",38,1180,"ESCOLA MUNICIPAL BARTOLOMEU GONÇALVES DE QUEIROZ","AV. PRINCIPAL, S/NR","PORTO DE FORA (ZONA RURAL)",78180000,2,"NA","NA","NA",NA,"NA","NA",NA,NA,NA,NA,NA,NA
"142",3160,91553381198,"MT",91553,"SANTO ANTÔNIO DO LEVERGER",38,1198,"ESCOLA MUNICIPAL ANTÔNIO FERREIRA DA SILVA NETO","AV. PRINCIPAL, S/NR","ENGENHO VELHO (ZONA RURAL)",78180000,1,"NA","NA","NA",NA,"NA","NA",NA,NA,NA,NA,NA,NA
"143",3162,91553381236,"MT",91553,"SANTO ANTÔNIO DO LEVERGER",38,1236,"ESCOLA MUNICIPAL DA PRAIA DO POÇO","AV. PRINCIPAL, S/NR","PRAIA DO POÇO (ZONA RURAL)",78180000,1,"NA","NA","NA",NA,"NA","NA",NA,NA,NA,NA,NA,NA
"144",3163,91553381252,"MT",91553,"SANTO ANTÔNIO DO LEVERGER",38,1252,"ESCOLA MUNICIPAL JOSÉ MARIA DA COSTA","AV. PRINCIPAL, S/NR","SANGRADOURO (ZONA RURAL)",78180000,2,"NA","NA","NA",NA,"NA","NA",NA,NA,NA,NA,NA,NA
"145",3165,91553381295,"MT",91553,"SANTO ANTÔNIO DO LEVERGER",38,1295,"ESCOLA ESTADUAL DO CÓRREGO DO OURO","AV. PRINCIPAL, S/NR","CÓRREGO DO OURO (ZONA RURAL)",78180000,1,"NA","NA","NA",NA,"NA","NA",NA,NA,NA,NA,NA,NA
"146",3166,91553381309,"MT",91553,"SANTO ANTÔNIO DO LEVERGER",38,1309,"ESCOLA MUNICIPAL DA GLEBA RESISTÊNCIA","AV. PRINCIPAL, S/NR","GLEBA RESISTÊNCIA (ZONA RURAL)",78180000,1,"NA","NA","NA",NA,"NA","NA",NA,NA,NA,NA,NA,NA
"147",3167,91553381350,"MT",91553,"SANTO ANTÔNIO DO LEVERGER",38,1350,"ESCOLA MUNICIPAL JOSÉ FERREIRA DA SILVA","AV. PRINCIPAL, S/NR","MORRINHO (PRÓXIMO RODOVIA - ZONA RURAL)",78180000,1,"NA","NA","NA",NA,"NA","NA",NA,NA,NA,NA,NA,NA
"148",3168,91553381376,"MT",91553,"SANTO ANTÔNIO DO LEVERGER",38,1376,"ESCOLA MUNICIPAL DO BREJINHO","AV. PRINCIPAL, S/NR","BREJINHO (ZONA RURAL)",78180000,1,"NA","NA","NA",NA,"NA","NA",NA,NA,NA,NA,NA,NA
"149",3171,91553381406,"MT",91553,"SANTO ANTÔNIO DO LEVERGER",38,1406,"ESCOLA MUNICIPAL DO VALE ABENÇOADO","AV. PRINCIPAL, S/NR","VALE ABENÇOADO (ZONA RURAL)",78180000,1,"NA","NA","NA",NA,"NA","NA",NA,NA,NA,NA,NA,NA
"150",3173,91553381430,"MT",91553,"SANTO ANTÔNIO DO LEVERGER",38,1430,"ESCOLA ESTADUAL DO PONTAL DO GLÓRIA","AV. PRINCIPAL, S/NR","PONTAL DO GLÓRIA (ZONA RURAL)",78180000,1,"NA","NA","NA",NA,"NA","NA",NA,NA,NA,NA,NA,NA
"151",3174,91553381457,"MT",91553,"SANTO ANTÔNIO DO LEVERGER",38,1457,"ESCOLA ESTADUAL DE SANTANA DO TAQUARAL","AV. PRINCIPAL, S/NR","SANTANA DO TAQUARAL (ZONA RURAL)",78180000,1,"NA","NA","NA",NA,"NA","NA",NA,NA,NA,NA,NA,NA
"152",3175,91553381465,"MT",91553,"SANTO ANTÔNIO DO LEVERGER",38,1465,"ESCOLA MUNICIPAL MANOEL CARLOS DE CARVALHO","AV. PRINCIPAL, S/NR","SÃO JOSÉ DA BOA VISTA (ZONA RURAL)",78180000,1,"NA","NA","NA",NA,"NA","NA",NA,NA,NA,NA,NA,NA
"153",3177,91553381481,"MT",91553,"SANTO ANTÔNIO DO LEVERGER",38,1481,"ESCOLA MUNICIPAL DO VALO VERDE","AV. PRINCIPAL, S/NR","VALO VERDE (ZONA RURAL)",78180000,1,"NA","NA","NA",NA,"NA","NA",NA,NA,NA,NA,NA,NA
"154",3178,91677201040,"MT",91677,"VÁRZEA GRANDE",20,1040,"CENTRO DE HABILITAÇÃO PROFISSIONAL PROFESSORA CELIA RODRIGUES DUQUE","RUA MIGUEL LEITE, 226","CENTRO",78110000,4,"NA","NA","NA",NA,"NA","NA",NA,NA,NA,NA,NA,NA
"155",3179,91677201104,"MT",91677,"VÁRZEA GRANDE",20,1104,"ESCOLA ESTADUAL PEDRO GARDES","AV. FILINTO MULLER    1511","CENTRO",78110000,8,"NA","NA","NA",NA,"NA","NA",NA,NA,NA,NA,NA,NA
"156",3180,91677201112,"MT",91677,"VÁRZEA GRANDE",20,1112,"ESCOLA MUNICIPAL PROFESSORA MARILCE BENEDITA DE ARRUDA","TRAVESSA MARIO MOTTA, S/N","CENTRO",78110000,6,"NA","NA","NA",NA,"NA","NA",NA,NA,NA,NA,NA,NA
"157",3181,91677201546,"MT",91677,"VÁRZEA GRANDE",20,1546,"ESCOLA ESTADUAL IRENE GOMES DE CAMPOS","ESTRADA DA GUARITA, S/N","FIGUEIRINHA",78110000,8,"NA","NA","NA",NA,"NA","NA",NA,NA,NA,NA,NA,NA
"158",3182,91677201554,"MT",91677,"VÁRZEA GRANDE",20,1554,"ESCOLA MUNICIPAL MANOEL JOÃO DE ARRUDA","RUA GONCALO DOMINGOS DE CAMPOS, SN","FIGUEIRINHA",78110000,5,"NA","NA","NA",NA,"NA","NA",NA,NA,NA,NA,NA,NA
"159",3183,91677201570,"MT",91677,"VÁRZEA GRANDE",20,1570,"ESCOLA ESTADUAL DEPUTADO MILTON FIGUEIREDO","AV. CRUZEIRO DO SUL, QUADRA 16, LOTE 20/21","JARDIM DOS ESTADOS",78110000,3,"NA","NA","NA",NA,"NA","NA",NA,NA,NA,NA,NA,NA
"160",3184,91677201589,"MT",91677,"VÁRZEA GRANDE",20,1589,"ESCOLA ESTADUAL UBALDO MONTEIRO DA SILVA","RUA MINAS GERAIS, S/N","JARDIM DOS ESTADOS",78110000,9,"NA","NA","NA",NA,"NA","NA",NA,NA,NA,NA,NA,NA
"161",3185,91677201597,"MT",91677,"VÁRZEA GRANDE",20,1597,"ESCOLA ESTADUAL NADIR DE OLIVEIRA","7 DE SETEMBRO,  S/N","JARDIM GLÓRIA I",78110000,16,"NA","NA","NA",NA,"NA","NA",NA,NA,NA,NA,NA,NA
"162",3186,91677201600,"MT",91677,"VÁRZEA GRANDE",20,1600,"ESCOLA MUNICIPAL PROFESSORA MARIA DAS GRACAS PINTO","RUA IARA, S/N","JARDIM GLÓRIA II",78110000,8,"NA","NA","NA",NA,"NA","NA",NA,NA,NA,NA,NA,NA
"163",3187,91677201619,"MT",91677,"VÁRZEA GRANDE",20,1619,"ESCOLA MUNICIPAL PROFESSORA IRENICE GODOY DE CAMPOS SILVA","RUA CAMARÕES, S/N","JARDIM IMPERIAL",78110000,9,"NA","NA","NA",NA,"NA","NA",NA,NA,NA,NA,NA,NA
"164",3188,91677201627,"MT",91677,"VÁRZEA GRANDE",20,1627,"ESCOLA ESTADUAL PROFESSOR VASTI PEREIRA DA CONCEIÇÃO","RUA CÁCERES, S/N","MAPIM",78110000,4,"NA","NA","NA",NA,"NA","NA",NA,NA,NA,NA,NA,NA
"165",3189,91677201635,"MT",91677,"VÁRZEA GRANDE",20,1635,"ESCOLA MUNICIPAL PROFESSORA RITA AUXILIADORA CAMPOS CUNHA","RUA VENEZUELA, S/N","MAPIM",78110000,6,"NA","NA","NA",NA,"NA","NA",NA,NA,NA,NA,NA,NA
"166",3190,91677201643,"MT",91677,"VÁRZEA GRANDE",20,1643,"ESCOLA MUNICIPAL JOÃO PONCE DE ARRUDA","DISTRITO DA PASSAGEM DA CONCEICAO, S/N","DISTRITO DA PASSAGEM DA CONCEICAO, S/N",78110000,1,"NA","NA","NA",NA,"NA","NA",NA,NA,NA,NA,NA,NA
"167",3191,91677201643,"MT",91677,"VÁRZEA GRANDE",20,1643,"ESCOLA MUNICIPAL JOÃO PONCE DE ARRUDA","DISTRITO DA PASSAGEM DA CONCEICAO, S/N","DISTRITO DE PASSAGEM DA CONCEICAO",78110000,1,"NA","NA","NA",NA,"NA","NA",NA,NA,NA,NA,NA,NA
"168",3192,91677201651,"MT",91677,"VÁRZEA GRANDE",20,1651,"CENTRO MUNICIPAL DE EDUCAÇÃO INFANTIL MAMED UNTAR","RUA MARFIM S/N","JARDIM DE ALÁ",78115000,3,"NA","NA","NA",NA,"NA","NA",NA,NA,NA,NA,NA,NA
"169",3193,91677201678,"MT",91677,"VÁRZEA GRANDE",20,1678,"ESCOLA MUNICIPAL ANA FRANCISCA DE BARROS","RUA CARLOS GOMES, S/N","VINTE E TRÊS DE SETEMBRO",78000000,4,"NA","NA","NA",NA,"NA","NA",NA,NA,NA,NA,NA,NA
"170",3194,91677201686,"MT",91677,"VÁRZEA GRANDE",20,1686,"ESCOLA MUNICIPAL JOAQUIM DA CRUZ COELHO","AVENIDA PROJETADA, S/N","SERRA DOURADA",78110000,3,"NA","NA","NA",NA,"NA","NA",NA,NA,NA,NA,NA,NA
"171",3195,91677201694,"MT",91677,"VÁRZEA GRANDE",20,1694,"ESCOLA MUNICIPAL PROFESSORA NAIR DE OLIVEIRA CORREA","RUA FRANCISCO MONTEIRO, S/N","MAPIM",78110000,4,"NA","NA","NA",NA,"NA","NA",NA,NA,NA,NA,NA,NA
"172",3196,91677201708,"MT",91677,"VÁRZEA GRANDE",20,1708,"ESCOLA MUNICIPAL ANTONIO GOMES DA CRUZ","RUA 07 DE SETEMBRO, S/N","JARDIM GLÓRIA I",78000000,6,"NA","NA","NA",NA,"NA","NA",NA,NA,NA,NA,NA,NA
"173",3197,91677201716,"MT",91677,"VÁRZEA GRANDE",20,1716,"ESCOLA MUNICIPAL PADRE LUIZ MARIA GHISONI","RUA C, QUADRA 31, S/N","VILA ARTHUR",78000000,7,"NA","NA","NA",NA,"NA","NA",NA,NA,NA,NA,NA,NA
"174",3198,91677201732,"MT",91677,"VÁRZEA GRANDE",20,1732,"ESCOLA ESTADUAL ANTONIO GERALDO GASPAROTO GATTIBONI","RUA NAPOLEAO JOSE DA  COSTA, S/N","PONTE NOVA",78115000,4,"NA","NA","NA",NA,"NA","NA",NA,NA,NA,NA,NA,NA
"175",3199,91677201740,"MT",91677,"VÁRZEA GRANDE",20,1740,"DELEGACIA FEDERAL DE AGRICULTURA DE MATO GROSSO (DEMA)","ALAMEDA DR.  ANIBAL MOLINA ,   S/N","PONTE NOVA",78115000,1,"NA","NA","NA",NA,"NA","NA",NA,NA,NA,NA,NA,NA
"176",3200,91677201759,"MT",91677,"VÁRZEA GRANDE",20,1759,"ESCOLA ESTADUAL PROFESSOR MARIA MACEDO RODRIGUES","RUA MARTIN ALFONSO, SN","MAPIM",78110000,8,"NA","NA","NA",NA,"NA","NA",NA,NA,NA,NA,NA,NA
"177",3201,91677201767,"MT",91677,"VÁRZEA GRANDE",20,1767,"CENTRO DE ATENCAO INTEGRAL À CRIANCA GONCALO DOMINGOS DE CAMPOS (CAIC)","RUA PIRAPORA, SN","JARDIM DE ALÁ",78000000,6,"NA","NA","NA",NA,"NA","NA",NA,NA,NA,NA,NA,NA
"178",3202,91677201775,"MT",91677,"VÁRZEA GRANDE",20,1775,"ESCOLA MUNICIPAL BENEDITA BERNARDINA CURVO","RUA 19, SN","COHAB NOVA IPE",78000000,7,"NA","NA","NA",NA,"NA","NA",NA,NA,NA,NA,NA,NA
"179",3203,91677201805,"MT",91677,"VÁRZEA GRANDE",20,1805,"ESCOLA MUNICIPAL DEPUTADO ARY LEITE DE CAMPOS","RUA H, QUADRA 14, S/N","PARQUE DAS MANGABEIRAS",78110000,2,"NA","NA","NA",NA,"NA","NA",NA,NA,NA,NA,NA,NA
"180",3204,91677201821,"MT",91677,"VÁRZEA GRANDE",20,1821,"ESCOLA ESTADUAL PROFESSOR JERCY JACOB","RUA SÃO JUDAS TADEU, S/N","ÁGUA VERMELHA",78110000,6,"NA","NA","NA",NA,"NA","NA",NA,NA,NA,NA,NA,NA
"181",3205,91677201830,"MT",91677,"VÁRZEA GRANDE",20,1830,"ESCOLA ESTADUAL MARIA LEITE MARCOSKI","RUA 05, QUADRA 20, S/N","JARDIM MARAJOARA",78110000,8,"NA","NA","NA",NA,"NA","NA",NA,NA,NA,NA,NA,NA
"182",3206,91677201848,"MT",91677,"VÁRZEA GRANDE",20,1848,"ESCOLA ESTADUAL PROFESSORA PORFIRIA PAULA DE CAMPOS","RUA ABDALA JOSE DE ALMEIDA, S/N","COHAB SANTA ISABEL",78110000,7,"NA","NA","NA",NA,"NA","NA",NA,NA,NA,NA,NA,NA
"183",3207,91677201856,"MT",91677,"VÁRZEA GRANDE",20,1856,"ESCOLA MUNICIPAL NAPOLEÃO JOSE DA COSTA","RUA 18, QD 37, S/N","JARDIM MARAJOARA",78110000,5,"NA","NA","NA",NA,"NA","NA",NA,NA,NA,NA,NA,NA
"184",3208,91677201864,"MT",91677,"VÁRZEA GRANDE",20,1864,"ESCOLA ESTADUAL MERCEDES DE PAULA SODA","RUA V, S/N","JARDIM PAULA I",78110000,6,"NA","NA","NA",NA,"NA","NA",NA,NA,NA,NA,NA,NA
"185",3209,91677201872,"MT",91677,"VÁRZEA GRANDE",20,1872,"ESCOLA ESTADUAL PROFESSORA ARLETE MARIA DA SILVA","RUA F, QUADRA 12, S/N","COHAB ASA BELA",78110000,9,"NA","NA","NA",NA,"NA","NA",NA,NA,NA,NA,NA,NA
"186",3210,91677201880,"MT",91677,"VÁRZEA GRANDE",20,1880,"ESCOLA MUNICIPAL SENHORA DIRCE LEITE DE CAMPOS","RUA MARQUES DE SAO VICENTE, QUADRA 58, S/N","JARDIM ITORORÓ",78110000,4,"NA","NA","NA",NA,"NA","NA",NA,NA,NA,NA,NA,NA
"187",3211,91677201899,"MT",91677,"VÁRZEA GRANDE",20,1899,"ESCOLA MUNICIPAL ARISTIDES POMPEO DE CAMPOS","RUA E QUADRA 22","CIDADE DE DEUS",78110000,3,"NA","NA","NA",NA,"NA","NA",NA,NA,NA,NA,NA,NA
"188",3212,91677201902,"MT",91677,"VÁRZEA GRANDE",20,1902,"ESCOLA ESTADUAL JAIME VERÍSSIMO DE CAMPOS JUNIOR","AV. CHILE, S/N","JARDIM TARUMÃ",78158590,3,"NA","NA","NA",NA,"NA","NA",NA,NA,NA,NA,NA,NA
"189",3213,91677201910,"MT",91677,"VÁRZEA GRANDE",20,1910,"CRECHE CENTRO EDUCACIONAL DE APOIO A FAMÍLIA","RUA DO AMOR, 182","JARDIM GLÓRIA II",78140780,3,"NA","NA","NA",NA,"NA","NA",NA,NA,NA,NA,NA,NA
"190",3214,91677201929,"MT",91677,"VÁRZEA GRANDE",20,1929,"CENTRO COMUNITÁRIO ALEIXO RAMOS","AO LADO DO TREVO, AV. MÁRIO ANDREAZA","DISTRITO DA GUARITA",78100000,2,"NA","NA","NA",NA,"NA","NA",NA,NA,NA,NA,NA,NA
"191",3215,91677201937,"MT",91677,"VÁRZEA GRANDE",20,1937,"ESCOLA MUNICIPAL EDNILSON FRANCISCO KOLLING","AVENIDA TIRADENTES Q. 03 SN","JARDIM MANAIRA",78150000,1,"NA","NA","NA",NA,"NA","NA",NA,NA,NA,NA,NA,NA
"192",3216,91677201945,"MT",91677,"VÁRZEA GRANDE",20,1945,"ESCOLA ESTADUAL GOVERNADOR DANTE MARTINS DE OLIVEIRA","RUA A SN","JARDIM TARUMÃ",78110000,1,"NA","NA","NA",NA,"NA","NA",NA,NA,NA,NA,NA,NA
"193",3217,91677201953,"MT",91677,"VÁRZEA GRANDE",20,1953,"CENTRO MUNIC.DE ATEND.ESPECIALIZ.E APOIO À INCLUSÃO JOÃO RIBEIRO FILHO","AV. SALIN NADAF","AV. SALIN NADAF",78110500,5,"NA","NA","NA",NA,"NA","NA",NA,NA,NA,NA,NA,NA
"194",3218,91677201961,"MT",91677,"VÁRZEA GRANDE",20,1961,"CASA DE ARTE E CULTURA DE VÁRZEA GRANDE","AVENIDA COUTO MAGALHÃES","AVENIDA COUTO MAGALHÃES",78110400,4,"NA","NA","NA",NA,"NA","NA",NA,NA,NA,NA,NA,NA
"195",3219,91677491015,"MT",91677,"VÁRZEA GRANDE",49,1015,"ESCOLA ESTADUAL DE 1º GRAU DEPUTADO SALIN NADAF","RUA Q, S/N","COHAB CRISTO REI",78115000,15,"NA","NA","NA",NA,"NA","NA",NA,NA,NA,NA,NA,NA
"196",3220,91677491023,"MT",91677,"VÁRZEA GRANDE",49,1023,"ESCOLA ESTADUAL DE 1º E 2º GRAUS JULIO MÜLLER","PROFESSORA ISABEL PINTO                CRISTO REI         S/N","CENTRO",78115000,10,"NA","NA","NA",NA,"NA","NA",NA,NA,NA,NA,NA,NA
"197",3221,91677491040,"MT",91677,"VÁRZEA GRANDE",49,1040,"ESCOLA ESTADUAL DE 1º GRAU DEPUTADO EMANUEL PINHEIRO","AV. DOM ORLANDO CHAVES  758","CRISTO REI",78115000,8,"NA","NA","NA",NA,"NA","NA",NA,NA,NA,NA,NA,NA
"198",3222,91677491058,"MT",91677,"VÁRZEA GRANDE",49,1058,"ESCOLA ESTADUAL DE 1º E 2º GRAUS JOSÉ LEITE DE MORÃES","RUA PROFESSORA ISABEL PINTO","CRISTO REI",78115000,14,"NA","NA","NA",NA,"NA","NA",NA,NA,NA,NA,NA,NA
"199",3223,91677491066,"MT",91677,"VÁRZEA GRANDE",49,1066,"ESCOLA ROBERTO COCHRANE SIMONSEN (SESI)","AV. DOM ORLANDO CHAVES                 CRISTO REI         1068","CENTRO",78115000,12,"NA","NA","NA",NA,"NA","NA",NA,NA,NA,NA,NA,NA
"200",3224,91677491074,"MT",91677,"VÁRZEA GRANDE",49,1074,"ESCOLA ESTADUAL DE 1º GRAU MANOEL GOMES","TRAVESSA SAO BENTO S/N","MANGA",78115000,7,"NA","NA","NA",NA,"NA","NA",NA,NA,NA,NA,NA,NA
"201",3225,91677491082,"MT",91677,"VÁRZEA GRANDE",49,1082,"ESCOLA ESTADUAL DE 1º GRAU PROF.DEMÉTRIO DE SOUZA","AV. MINEIRÃO S/N","ALTO DA BOA VISTA",78115000,9,"NA","NA","NA",NA,"NA","NA",NA,NA,NA,NA,NA,NA
"202",3226,91677491090,"MT",91677,"VÁRZEA GRANDE",49,1090,"ESCOLA ESTADUAL DE 1º GRAU HEROCLITO LEÔNCIO MONTEIRO","RUA F, QUADRA 12 S/N","COHAB JAIME CAMPOS",78115000,8,"NA","NA","NA",NA,"NA","NA",NA,NA,NA,NA,NA,NA
"203",3227,91677491104,"MT",91677,"VÁRZEA GRANDE",49,1104,"ESCOLA ESTADUAL DE 1º GRAU DUNGA RODRIGUES","AV SÉRGIO JULIÃO DE BRITO 520","PARQUE DO LAGO",78115000,10,"NA","NA","NA",NA,"NA","NA",NA,NA,NA,NA,NA,NA
"204",3228,91677491171,"MT",91677,"VÁRZEA GRANDE",49,1171,"ESCOLA ESTADUAL DE 1º GRAU MANOEL CORREIA DE ALMEIDA","MANOEL LINO MOREIRA TRIAL S/N","ALAMEDA JULIO MÜLLER",78115000,6,"NA","NA","NA",NA,"NA","NA",NA,NA,NA,NA,NA,NA
"205",3229,91677491198,"MT",91677,"VÁRZEA GRANDE",49,1198,"ESCOLA MUNICIPAL DE 1º GRAU  TEN. WALDOMIRO DELGADO BERTULIO","AV. SÃO GONÇALO S/N","PARQUE DO LAGO",78115000,3,"NA","NA","NA",NA,"NA","NA",NA,NA,NA,NA,NA,NA
"206",3231,91677491210,"MT",91677,"VÁRZEA GRANDE",49,1210,"ESCOLA ESTADUAL DE 1º GRAU HONÓRIO RODRIGUES AMORIM","RUA 14 ,  QD 22","COHAB DOM ORLANDO CHAVES",78000000,3,"NA","NA","NA",NA,"NA","NA",NA,NA,NA,NA,NA,NA
"207",3232,91677491228,"MT",91677,"VÁRZEA GRANDE",49,1228,"ESCOLA ESTADUAL DE 1ºGRAU DOM BOSCO","ALAMEDA A - QUADRA 9 S/N","COHAB DOM BOSCO",78115000,6,"NA","NA","NA",NA,"NA","NA",NA,NA,NA,NA,NA,NA
"208",3233,91677491244,"MT",91677,"VÁRZEA GRANDE",49,1244,"ESCOLA ESTADUAL DE 1º GRAU JOSÉ MENDES MARTINS","JOÃO LOPES MACEDO SN","PARQUE DO LAGO",78115000,7,"NA","NA","NA",NA,"NA","NA",NA,NA,NA,NA,NA,NA
"209",3234,91677491252,"MT",91677,"VÁRZEA GRANDE",49,1252,"ESCOLA MUNICIPAL DE 1º GRAU PROFESSORA JUVENILIA MONTEIRO DE OLIVEIRA","RUA PRINCIPAL DISTRITO ENGORDADOR","CENTRO",78110000,2,"NA","NA","NA",NA,"NA","NA",NA,NA,NA,NA,NA,NA
"210",3235,91677491260,"MT",91677,"VÁRZEA GRANDE",49,1260,"CENTRO EDUCACIONAL SALVELINA FERREIRA DA SILVA","AV. SÃO SEBASTIÃO, S/N","MARINGA III",78000000,9,"NA","NA","NA",NA,"NA","NA",NA,NA,NA,NA,NA,NA
"211",3236,91677491287,"MT",91677,"VÁRZEA GRANDE",49,1287,"ESCOLA MUNICIPAL APOLONIO FRUTUOSO DA SILVA","AV WALTER FONTANA SN","CONSTRUMAT",78115000,2,"NA","NA","NA",NA,"NA","NA",NA,NA,NA,NA,NA,NA
"212",3237,91677491295,"MT",91677,"VÁRZEA GRANDE",49,1295,"ESCOLA MUNICIPAL ANA ROSA DA SILVA","RUA ARI PAES BARRETO SN","CRISTO REI",78115000,5,"NA","NA","NA",NA,"NA","NA",NA,NA,NA,NA,NA,NA
"213",3238,91677491309,"MT",91677,"VÁRZEA GRANDE",49,1309,"ESCOLA MUNICIPAL MARIA JOANA DA S. ALMEIDA","RUA B SN","UNIPARK",78115000,2,"NA","NA","NA",NA,"NA","NA",NA,NA,NA,NA,NA,NA
"214",3239,91677491317,"MT",91677,"VÁRZEA GRANDE",49,1317,"ESCOLA ESTADUAL DE 1º GRAU DOMINGOS SÁVIO BRANDÃO DE LIMA","RUA MANOEL VARGAS","CRISTO REI",78115000,7,"NA","NA","NA",NA,"NA","NA",NA,NA,NA,NA,NA,NA
"215",3240,91677491325,"MT",91677,"VÁRZEA GRANDE",49,1325,"ESCOLA ESTADUAL HERNANDY MAURICIO BARACAT DE ARRUDA","RUA MOARADA NOVA SN","PARQUE DO LAGO",78115000,6,"NA","NA","NA",NA,"NA","NA",NA,NA,NA,NA,NA,NA
"216",3241,91677491333,"MT",91677,"VÁRZEA GRANDE",49,1333,"E.M.P.G. PROF.MARIA BARBOSA MARTINS","DISTRITO DE BONSUCESSO","ZONA RURAL",78110000,2,"NA","NA","NA",NA,"NA","NA",NA,NA,NA,NA,NA,NA
"217",3242,91677491341,"MT",91677,"VÁRZEA GRANDE",49,1341,"E.M.P.G. PROF. MARIA DE LOURDES T. AREIAS","AV. PRINCIPAL - DIST. PRAIA GRANDE","ZONA RURAL",78110000,2,"NA","NA","NA",NA,"NA","NA",NA,NA,NA,NA,NA,NA
"218",3243,91677491350,"MT",91677,"VÁRZEA GRANDE",49,1350,"CAMARA MUNICIPAL DE VARZEA GRANDE","AV. CASTELO BRANCO   S/N","ÁGUA LIMPA",78110000,7,"NA","NA","NA",NA,"NA","NA",NA,NA,NA,NA,NA,NA
"219",3244,91677491368,"MT",91677,"VÁRZEA GRANDE",49,1368,"ESC.EST. DE I E II GRAUS LECINIO MONTEIRO SILVA'","AV. PEDRO PEDROSSIAN   N 211","CENTRO",78110000,7,"NA","NA","NA",NA,"NA","NA",NA,NA,NA,NA,NA,NA
"220",3245,91677491384,"MT",91677,"VÁRZEA GRANDE",49,1384,"ESC.EST. DE I GRAU 'ADALGISA DE BARROS'","GOVER. PEDRO PREDROSSIAN       S/N","CENTRO",78110000,11,"NA","NA","NA",NA,"NA","NA",NA,NA,NA,NA,NA,NA
"221",3246,91677491406,"MT",91677,"VÁRZEA GRANDE",49,1406,"ESC.EST. DE I GRAU 'VANIL STABILITO'","RUA 'B' - QUADRA 16 COHAB NOSS. SENH. GUIA  S/N","ÁGUA LIMPA",78110000,9,"NA","NA","NA",NA,"NA","NA",NA,NA,NA,NA,NA,NA
"222",3247,91677491422,"MT",91677,"VÁRZEA GRANDE",49,1422,"QUINTA CIRETRAN","PRES ARTHUR BERNARDES   SN","JARDIM AEROPORTO",78000000,4,"NA","NA","NA",NA,"NA","NA",NA,NA,NA,NA,NA,NA
"223",3248,91677491430,"MT",91677,"VÁRZEA GRANDE",49,1430,"ESC.EST.1 E 2 GRAUS 'ELMAZ GATTASS MONTEIRO","AV. MARECHAL HERMES DA FONSECA        IPASE              S/N","IPASE",78110000,12,"NA","NA","NA",NA,"NA","NA",NA,NA,NA,NA,NA,NA
"224",3249,91677491457,"MT",91677,"VÁRZEA GRANDE",49,1457,"ESC.EST.DE I E II GRAUS 'DEPUT. GONCALO BOTELHO DE CAMPOS","RUA JACOB DO BANDOLIM  N  02","JARDIM COSTA VERDE",78110000,11,"NA","NA","NA",NA,"NA","NA",NA,NA,NA,NA,NA,NA
"225",3250,91677491465,"MT",91677,"VÁRZEA GRANDE",49,1465,"ESC. ESTADUAL DE I GRAU 'MIGUEL BARACAT'","PRINCIPAL  SN","PIRINEU",78110000,4,"NA","NA","NA",NA,"NA","NA",NA,NA,NA,NA,NA,NA
"226",3251,91677581015,"MT",91677,"VÁRZEA GRANDE",58,1015,"E.M.E.B. PROF.ANTONIO SALUSTIO AREIAS","AV. LEONCIO LOPES MIRANDA, S/N- CAPELA PISSARRAO","CAPELA DO PIÇARRÃO",78110000,5,"NA","NA","NA",NA,"NA","NA",NA,NA,NA,NA,NA,NA
"227",3253,91677581031,"MT",91677,"VÁRZEA GRANDE",58,1031,"E.E. MARIA DA CUNHA BRUNO","AV. A S/N","JARDIM PRIMAVERA",78015000,5,"NA","NA","NA",NA,"NA","NA",NA,NA,NA,NA,NA,NA
"228",3254,91677581040,"MT",91677,"VÁRZEA GRANDE",58,1040,"E.M.E.B. PROFESSORA RUTH MARTINS SANTANA","RUA M, S/N -  JARDIM IKARAI","JARDIM IKARAÍ",78110000,5,"NA","NA","NA",NA,"NA","NA",NA,NA,NA,NA,NA,NA
"229",3255,91677581066,"MT",91677,"VÁRZEA GRANDE",58,1066,"CAPELA NOSSA SENHORA APARECIDA","DISTRITO DE ESPINHEIRO","ZONA RURAL",78110000,1,"NA","NA","NA",NA,"NA","NA",NA,NA,NA,NA,NA,NA
"230",3256,91677581112,"MT",91677,"VÁRZEA GRANDE",58,1112,"ESCOLA MUNICIPAL 'VEREADOR ESTEVÃO FERREIRA DA CUNHA'","RUA PRINCIPAL, S/N","DISTRITO DE SOUZA LIMA",78110000,3,"NA","NA","NA",NA,"NA","NA",NA,NA,NA,NA,NA,NA
"231",3257,91677581120,"MT",91677,"VÁRZEA GRANDE",58,1120,"E.M.E.B. VEREADOR ZENO DE OLIVEIRA","RUA ANTIDIO MANOEL DA SILVA, S/N - PAI ANDRÉ","DISTRITO PAI ANDRÉ",78110000,1,"NA","NA","NA",NA,"NA","NA",NA,NA,NA,NA,NA,NA
"232",3258,91677581139,"MT",91677,"VÁRZEA GRANDE",58,1139,"E.M. EURAIDES DE PAULA","AV. PRINCIPAL, S/N  -  DISTRITO DE LIMPO GRANDE","ZONA RURAL",78110000,2,"NA","NA","NA",NA,"NA","NA",NA,NA,NA,NA,NA,NA
"233",3259,91677581147,"MT",91677,"VÁRZEA GRANDE",58,1147,"E.M.E.B. JULIO DOMINGOS DE CAMPOS","RUA LUIS PEDRO DE LIMA, 908 - CAPÃO GRANDE","DISTRITO DE CAPÃO GRANDE",78110000,6,"NA","NA","NA",NA,"NA","NA",NA,NA,NA,NA,NA,NA
"234",3260,91677581155,"MT",91677,"VÁRZEA GRANDE",58,1155,"E.M.E.B. PROFESSORA ANGELA JARDIM","RUA Z, S/N - COHAB CANELLAS","COHAB CANELLAS",78110000,9,"NA","NA","NA",NA,"NA","NA",NA,NA,NA,NA,NA,NA
"235",3261,91677581171,"MT",91677,"VÁRZEA GRANDE",58,1171,"ESCOLA MUNICIPAL DE ED. BÁSICA DAVY MAYER","AV. PRINCIPAL S/N - SÃO SIMÃO","SÃO SIMÃO",78110000,5,"NA","NA","NA",NA,"NA","NA",NA,NA,NA,NA,NA,NA
"236",3262,91677581201,"MT",91677,"VÁRZEA GRANDE",58,1201,"E.M.E.B. FAUSTINO ANTONIO DA SILVA","RUA CLARO ALVES - QUADRA 80 - COLINAS VERDEJANTES","COLINAS VERDEJANTES",78110000,3,"NA","NA","NA",NA,"NA","NA",NA,NA,NA,NA,NA,NA
"237",3263,91677581210,"MT",91677,"VÁRZEA GRANDE",58,1210,"E.M.E.B. HONORATO PEDROSO DE BARROS","AV. FILINTO MULLER, SN - ÁGUA VERMELHA","ÁGUA VERMELHA",78110000,3,"NA","NA","NA",NA,"NA","NA",NA,NA,NA,NA,NA,NA
"238",3264,91677581228,"MT",91677,"VÁRZEA GRANDE",58,1228,"ESCOLA MUNICIPAL PROF. LUCIA LEITE RODRIGUES","VARZEA GRANDE ESQ. COM R.BARRA DO GARÇAS S/N","LOTEAMENTO NOVO MATO GROSSO",78000000,4,"NA","NA","NA",NA,"NA","NA",NA,NA,NA,NA,NA,NA
"239",3265,91677581236,"MT",91677,"VÁRZEA GRANDE",58,1236,"E.M.E.B. PROFESSORA LIBIA DA COSTA RONDON","AV.PRINCIPAL DE ACESSO PRAIA GRANDE S/N","RESIDENCIAL JARDIM BOTÂNICO",78000000,7,"NA","NA","NA",NA,"NA","NA",NA,NA,NA,NA,NA,NA
"240",3266,91677581244,"MT",91677,"VÁRZEA GRANDE",58,1244,"ESCOLA ESTADUAL ELIZABETH MARIA BASTOS MINEIRO","RUA 15 QUADRA 112 S/S","SÃO MATEUS",78015000,5,"NA","NA","NA",NA,"NA","NA",NA,NA,NA,NA,NA,NA
"241",3267,91677581260,"MT",91677,"VÁRZEA GRANDE",58,1260,"E.M.E.B. ANTONIA FELIPA DE CAMPOS'","RUA SD, QUADRA 100","NOVO MUNDO",78110000,1,"NA","NA","NA",NA,"NA","NA",NA,NA,NA,NA,NA,NA
"242",3268,91677581279,"MT",91677,"VÁRZEA GRANDE",58,1279,"E.M.E.B. BIANKA LORENA DA ROCHA CAPILÉ","AGROVILA SÃO MIGUEL - ASSENTAMENTO SADIA III","ZONA RURAL",78170000,2,"NA","NA","NA",NA,"NA","NA",NA,NA,NA,NA,NA,NA
"243",3269,91677581287,"MT",91677,"VÁRZEA GRANDE",58,1287,"ESCOLA  MUNICIPAL  PROFESSORA AIR ADDOR","RUA DEZ SN","COHAB OURO VERDE",78148900,5,"NA","NA","NA",NA,"NA","NA",NA,NA,NA,NA,NA,NA
"244",3270,91677581309,"MT",91677,"VÁRZEA GRANDE",58,1309,"E.M.E.B. BENEDITO ABRÃO NASSARDEM","LOCALIDADE DE FORMIGUEIRO","ZONA RURAL",78110000,1,"NA","NA","NA",NA,"NA","NA",NA,NA,NA,NA,NA,NA
"245",3271,91677581333,"MT",91677,"VÁRZEA GRANDE",58,1333,"ESCOLA ESTADUAL 'FERNANDO LEITE DE CAMPOS'","AV. ALZIRA SANTANA ,  N 347","CENTRO",78150000,16,"NA","NA","NA",NA,"NA","NA",NA,NA,NA,NA,NA,NA
"246",3272,91677581341,"MT",91677,"VÁRZEA GRANDE",58,1341,"CENTRO DE ESPECIALIDADES - POSTO DE SAÚDE","RUA SANTO ANTONIO","CENTRO",78150000,3,"NA","NA","NA",NA,"NA","NA",NA,NA,NA,NA,NA,NA
"247",3273,91677581350,"MT",91677,"VÁRZEA GRANDE",58,1350,"CENTRO EDUCACIONAL ABDALA JOSÉ DE ALMEIDA","RUA 32, QUADRA 165","SÃO MATEUS",78110000,10,"NA","NA","NA",NA,"NA","NA",NA,NA,NA,NA,NA,NA
"248",3274,91677581368,"MT",91677,"VÁRZEA GRANDE",58,1368,"ESCOLA MUNICIPAL E. BÁSICA LUIZ REVELES PEREIRA","RUA N, QUADRA 26","PORTAL DA AMAZÔNIA",78110000,2,"NA","NA","NA",NA,"NA","NA",NA,NA,NA,NA,NA,NA
"249",3275,91677581376,"MT",91677,"VÁRZEA GRANDE",58,1376,"ESCOLA MUNICIPAL LENINE DE CAMPOS POVOAS","AV PRINCIPAL SN","LOTEAMENTO PARQUE DAS ESTAÇÕES",78110000,1,"NA","NA","NA",NA,"NA","NA",NA,NA,NA,NA,NA,NA
"250",3276,91677581392,"MT",91677,"VÁRZEA GRANDE",58,1392,"EMEB JOSE ESTEJO DE CAMPOS","RUA 23 Q 30 BAIRRO VITORIA REGIA","JARDIM VITORIA RÉGIA",78000000,1,"NA","NA","NA",NA,"NA","NA",NA,NA,NA,NA,NA,NA
"251",3277,91677581406,"MT",91677,"VÁRZEA GRANDE",58,1406,"EMEB PROF MARIA PEDROSA DE MIRANDA","R 15, QUADRA 15, LOTE 01","PARQUE DO SABIÁ",78000000,2,"NA","NA","NA",NA,"NA","NA",NA,NA,NA,NA,NA,NA
"252",3278,91677581414,"MT",91677,"VÁRZEA GRANDE",58,1414,"EMEB JAIME VERISSIMO DE CAMPOS JÚNIOR","RUA SÃO PAULO S/N","NOVA VÁRZEA GRANDE",78000000,2,"NA","NA","NA",NA,"NA","NA",NA,NA,NA,NA,NA,NA
"253",3279,91677581422,"MT",91677,"VÁRZEA GRANDE",58,1422,"E ESTADUAL PROF TEREZINHA DE JESUS DA SILVA","RUA 15, Q 56 S/N","NOVA FRONTEIRA",78000000,1,"NA","NA","NA",NA,"NA","NA",NA,NA,NA,NA,NA,NA
